{
  "configPath": "~/.openclaw/openclaw.json",
  "summary": {
    "addAccounts": 3,
    "addBindings": 3,
    "addAgents": 3,
    "mkdirCount": 6
  },
  "jsonPatchPreview": [
    {
      "op": "add",
      "path": "/channels/feishu/accounts/manager",
      "value": {
        "appId": "cli_xxx_manager",
        "appSecret": "<redacted-at-preview>",
        "botName": "总控机器人",
        "enabled": true
      }
    },
    {
      "op": "add",
      "path": "/channels/feishu/accounts/research",
      "value": {
        "appId": "cli_xxx_research",
        "appSecret": "<redacted-at-preview>",
        "botName": "调研机器人",
        "enabled": true
      }
    },
    {
      "op": "add",
      "path": "/channels/feishu/accounts/writer",
      "value": {
        "appId": "cli_xxx_writer",
        "appSecret": "<redacted-at-preview>",
        "botName": "写作机器人",
        "enabled": true
      }
    },
    {
      "op": "add",
      "path": "/bindings/-",
      "value": {
        "agentId": "manager",
        "match": {
          "channel": "feishu",
          "accountId": "manager"
        }
      }
    },
    {
      "op": "add",
      "path": "/bindings/-",
      "value": {
        "agentId": "research",
        "match": {
          "channel": "feishu",
          "accountId": "research"
        }
      }
    },
    {
      "op": "add",
      "path": "/bindings/-",
      "value": {
        "agentId": "writer",
        "match": {
          "channel": "feishu",
          "accountId": "writer"
        }
      }
    },
    {
      "op": "add",
      "path": "/agents/list/-",
      "value": {
        "id": "manager",
        "workspace": "~/.openclaw/workspace-manager",
        "agentDir": "~/.openclaw/agents/manager/agent"
      }
    },
    {
      "op": "add",
      "path": "/agents/list/-",
      "value": {
        "id": "research",
        "workspace": "~/.openclaw/workspace-research",
        "agentDir": "~/.openclaw/agents/research/agent"
      }
    },
    {
      "op": "add",
      "path": "/agents/list/-",
      "value": {
        "id": "writer",
        "workspace": "~/.openclaw/workspace-writer",
        "agentDir": "~/.openclaw/agents/writer/agent"
      }
    }
  ],
  "filesystemPreview": [
    {
      "op": "mkdir",
      "path": "~/.openclaw/workspace-manager",
      "reason": "workspace for manager"
    },
    {
      "op": "mkdir",
      "path": "~/.openclaw/agents/manager/agent",
      "reason": "agentDir for manager"
    },
    {
      "op": "mkdir",
      "path": "~/.openclaw/workspace-research",
      "reason": "workspace for research"
    },
    {
      "op": "mkdir",
      "path": "~/.openclaw/agents/research/agent",
      "reason": "agentDir for research"
    },
    {
      "op": "mkdir",
      "path": "~/.openclaw/workspace-writer",
      "reason": "workspace for writer"
    },
    {
      "op": "mkdir",
      "path": "~/.openclaw/agents/writer/agent",
      "reason": "agentDir for writer"
    }
  ],
  "warnings": []
}
